{
  "$id": "https://raw.githubusercontent.com/pluxain/clantl/refs/heads/main/public/schemas/checklist.schema.json",
  "$schema": "https://json-schema.org/draft-07/schema#",
  "title": "CheckList",
  "description": "JSON Schema for a CheckList in clantl",
  "type": "object",
  "properties": {
    "items": {
      "description": "KillerItems of the CheckList",
      "type": "array",
      "items": {
        "description": "KillerItem of a CheckList",
        "$ref": "https://raw.githubusercontent.com/pluxain/clantl/refs/heads/main/public/schemas/killeritem.schema.json"
      },
      "minItems": 1,
      "maxItems": 8,
      "uniqueItems": true
    },
    "kind": {
      "description": "The discriminating property of the file",
      "const": "CheckList"
    },
    "locale": {
      "description": "Locale of the CheckList",
      "enum": ["en", "fr"]
    },
    "name": {
      "description": "Name of the CheckList",
      "type": "string"
    },
    "nextStep": {
      "description": "Next Step after the CheckList is completed",
      "type": "string"
    },
    "realm": {
      "description": "Which Realm belongs the CheckList",
      "type": "string"
    },
    "step": {
      "description": "Which Step belongs the CheckList",
      "type": "string"
    }
  },
  "required": ["items", "locale", "name", "nextStep", "realm", "step"]
}
