{
  "$schema": "https://raw.githubusercontent.com/pluxain/clantl/refs/heads/main/public/schemas/checklist.schema.json",
  "items": [
    {
      "label": "matériel d'intubation",
      "keyword": "vérifié",
      "verified": false
    },
    {
      "label": "oxygène",
      "keyword": "disponible",
      "verified": false
    },
    {
      "label": "circuit / Ballon de réanimation",
      "keyword": "testé",
      "verified": false
    },
    {
      "label": "valve d'échappement",
      "keyword": "Ouverte",
      "verified": false
    },
    {
      "label": "ballonnet sonde endotrachéale",
      "keyword": "étanche",
      "verified": false
    },
    {
      "label": "cathéter",
      "keyword": "fonctionnel",
      "verified": false
    },
    {
      "label": "procédure de réanimation",
      "keyword": "prête",
      "verified": false
    },
    {
      "label": "responsable de la surveillance",
      "keyword": "nommé",
      "verified": false
    }
  ],
  "locale": "fr",
  "name": "avant induction",
  "nextStep": "induction",
  "realm": "anesthesie",
  "step": "preparation-et-premedication"
}
