{
  "$schema": "https://raw.githubusercontent.com/pluxain/clantl/refs/heads/main/public/schemas/checklist.schema.json",
  "items": [
    {
      "label": "parient / intervention / zone",
      "keyword": "confirmés",
      "kind": "KillerItem",
      "verified": false
    },
    {
      "label": "adjuvant analgésique",
      "keyword": "en place",
      "kind": "KillerItem",
      "verified": false
    },
    {
      "label": "profondeur de l'anesthésie",
      "keyword": "vérifiée",
      "kind": "KillerItem",
      "verified": false
    }
  ],
  "kind": "CheckList",
  "locale": "fr",
  "name": "avant chirurgie",
  "nextStep": "chirurgie",
  "realm": "anesthesie",
  "step": "induction"
}
