{
  "$schema": "https://raw.githubusercontent.com/pluxain/clantl/refs/heads/main/public/schemas/checklist.schema.json",
  "items": [
    {
      "label": "plan thérapeutique post-intervention",
      "keyword": "défini",
      "kind": "KillerItem",
      "verified": false
    },
    {
      "label": "plan analgésique",
      "keyword": "en place",
      "kind": "KillerItem",
      "verified": false
    },
    {
      "label": "surveillance post-anesthésique",
      "keyword": "définie",
      "kind": "KillerItem",
      "verified": false
    }
  ],
  "kind": "CheckList",
  "locale": "fr",
  "name": "avant réveil",
  "nextStep": "reveil",
  "realm": "anesthesie",
  "step": "chirurgie"
}
